{
  "spec": "https://hpro.example/spec/0.1",
  "catalog": {
    "part": "1",
    "version": "0.1",
    "rules": 156
  },
  "tool": {
    "name": "hpro-check (hpro Konformitätsprüfer)",
    "version": "0.1.0"
  },
  "checkedAt": "2026-10-12T09:32:15Z",
  "file": {
    "name": "lebendig.hpro",
    "size": 28922,
    "sha256": "4b790910c7aa5f7e12f2da7a2fc281a52aa16f5d84211ec51825f93cf33a204d"
  },
  "strict": false,
  "levels": {
    "claimed": [
      "Basis",
      "Lebendig"
    ],
    "requested": [],
    "verdict": {
      "Basis": "unbestimmt",
      "Lebendig": "unbestimmt"
    }
  },
  "renditions": [
    {
      "id": null,
      "profile": "interactive",
      "verdict": {
        "Basis": "unbestimmt",
        "Lebendig": "unbestimmt"
      }
    }
  ],
  "summary": {
    "fatal": 0,
    "error": 0,
    "warning": 0,
    "info": 0,
    "notChecked": 7
  },
  "results": [],
  "notChecked": [
    {
      "rule": "HPR-INH-004",
      "reason": "missing-means",
      "detail": "keine Browser-Engine im Prüfer angebunden (Mittel rendering)"
    },
    {
      "rule": "HPR-INH-006",
      "reason": "missing-means",
      "detail": "keine Browser-Engine im Prüfer angebunden (Mittel rendering)"
    },
    {
      "rule": "HPR-INH-022",
      "reason": "missing-means",
      "detail": "keine Browser-Engine im Prüfer angebunden (Mittel rendering)"
    },
    {
      "rule": "HPR-LOCK-005",
      "reason": "missing-means",
      "detail": "keine Liste redigierter Begriffe übergeben (--redacted)"
    },
    {
      "rule": "HPR-SBX-010",
      "reason": "missing-means",
      "detail": "keine Browser-Engine im Prüfer angebunden (Mittel rendering)"
    },
    {
      "rule": "HPR-SBX-012",
      "reason": "missing-means",
      "detail": "keine Browser-Engine im Prüfer angebunden (Mittel rendering)"
    },
    {
      "rule": "HPR-SBX-015",
      "reason": "missing-means",
      "detail": "keine Browser-Engine im Prüfer angebunden (Mittel rendering)"
    }
  ]
}
