{
  "spec": "https://hpro.example/spec/0.1",
  "catalog": {
    "part": "1",
    "version": "0.1",
    "rules": 156
  },
  "tool": {
    "name": "hpro-check (hpro Konformitätsprüfer)",
    "version": "0.1.0"
  },
  "checkedAt": "2026-10-12T00:44:39Z",
  "file": {
    "name": "gut-fassungen.hpro",
    "size": 12653,
    "sha256": "a3f791887fd6190448c16effe45e930bc18b85c2f9ca62baa1c2d9b5df8aaaa3"
  },
  "strict": false,
  "levels": {
    "claimed": [
      "Basis",
      "Lebendig",
      "Signiert"
    ],
    "requested": [],
    "verdict": {
      "Basis": "unbestimmt",
      "Lebendig": "unbestimmt",
      "Signiert": "unbestimmt"
    }
  },
  "renditions": [
    {
      "id": null,
      "profile": "interactive",
      "verdict": {
        "Basis": "unbestimmt",
        "Lebendig": "unbestimmt",
        "Signiert": "unbestimmt"
      }
    },
    {
      "id": "nachweis-2026-10-11",
      "profile": "signed",
      "verdict": {
        "Basis": "unbestimmt",
        "Lebendig": "unbestimmt",
        "Signiert": "unbestimmt"
      }
    }
  ],
  "summary": {
    "fatal": 0,
    "error": 0,
    "warning": 1,
    "info": 8,
    "notChecked": 9
  },
  "results": [
    {
      "rule": "HPR-SIG-012",
      "class": "WARNING",
      "level": "Signiert",
      "rendition": null,
      "message": "Signatur sig-fassung: kein Signaturzeitstempel (Niveau XAdES-BASELINE-B; empfohlen `XAdES-BASELINE-T`).",
      "location": {
        "kind": "signature",
        "path": "META-INF/signatures.xml",
        "signatureId": "sig-fassung"
      },
      "params": {
        "signatur": "sig-fassung",
        "wert": "XAdES-BASELINE-B"
      },
      "requirements": [
        "HP-SIG-010"
      ]
    },
    {
      "rule": "HPR-SIG-017",
      "class": "INFO",
      "level": "Signiert",
      "rendition": null,
      "message": "Datei package.opf ist nicht signiert.",
      "location": {
        "kind": "entry",
        "path": "package.opf"
      },
      "params": {
        "pfad": "package.opf"
      },
      "requirements": [
        "HP-SIG-013"
      ]
    },
    {
      "rule": "HPR-SIG-017",
      "class": "INFO",
      "level": "Signiert",
      "rendition": null,
      "message": "Datei manifest.json ist nicht signiert.",
      "location": {
        "kind": "entry",
        "path": "manifest.json"
      },
      "params": {
        "pfad": "manifest.json"
      },
      "requirements": [
        "HP-SIG-013"
      ]
    },
    {
      "rule": "HPR-SIG-017",
      "class": "INFO",
      "level": "Signiert",
      "rendition": null,
      "message": "Datei components/hp-calc@1.0.0/hp-calc.js ist nicht signiert.",
      "location": {
        "kind": "entry",
        "path": "components/hp-calc@1.0.0/hp-calc.js"
      },
      "params": {
        "pfad": "components/hp-calc@1.0.0/hp-calc.js"
      },
      "requirements": [
        "HP-SIG-013"
      ]
    },
    {
      "rule": "HPR-SIG-017",
      "class": "INFO",
      "level": "Signiert",
      "rendition": null,
      "message": "Datei content/anhang.xhtml ist nicht signiert.",
      "location": {
        "kind": "entry",
        "path": "content/anhang.xhtml"
      },
      "params": {
        "pfad": "content/anhang.xhtml"
      },
      "requirements": [
        "HP-SIG-013"
      ]
    },
    {
      "rule": "HPR-SIG-017",
      "class": "INFO",
      "level": "Signiert",
      "rendition": null,
      "message": "Datei content/index.xhtml ist nicht signiert.",
      "location": {
        "kind": "entry",
        "path": "content/index.xhtml"
      },
      "params": {
        "pfad": "content/index.xhtml"
      },
      "requirements": [
        "HP-SIG-013"
      ]
    },
    {
      "rule": "HPR-SIG-017",
      "class": "INFO",
      "level": "Signiert",
      "rendition": null,
      "message": "Datei content/media/skizze.svg ist nicht signiert.",
      "location": {
        "kind": "entry",
        "path": "content/media/skizze.svg"
      },
      "params": {
        "pfad": "content/media/skizze.svg"
      },
      "requirements": [
        "HP-SIG-013"
      ]
    },
    {
      "rule": "HPR-SIG-017",
      "class": "INFO",
      "level": "Signiert",
      "rendition": null,
      "message": "Datei content/nav.xhtml ist nicht signiert.",
      "location": {
        "kind": "entry",
        "path": "content/nav.xhtml"
      },
      "params": {
        "pfad": "content/nav.xhtml"
      },
      "requirements": [
        "HP-SIG-013"
      ]
    },
    {
      "rule": "HPR-SIG-017",
      "class": "INFO",
      "level": "Signiert",
      "rendition": null,
      "message": "Datei content/styles/document.css ist nicht signiert.",
      "location": {
        "kind": "entry",
        "path": "content/styles/document.css"
      },
      "params": {
        "pfad": "content/styles/document.css"
      },
      "requirements": [
        "HP-SIG-013"
      ]
    }
  ],
  "notChecked": [
    {
      "rule": "HPR-CONT-024",
      "reason": "missing-means",
      "detail": "kein EPUB-Validator angebunden"
    },
    {
      "rule": "HPR-CONT-028",
      "reason": "missing-means",
      "detail": "kein EPUB-Validator angebunden"
    },
    {
      "rule": "HPR-INH-004",
      "reason": "missing-means",
      "detail": "keine Browser-Engine im Prüfer angebunden (Mittel rendering)"
    },
    {
      "rule": "HPR-INH-006",
      "reason": "missing-means",
      "detail": "keine Browser-Engine im Prüfer angebunden (Mittel rendering)"
    },
    {
      "rule": "HPR-INH-022",
      "reason": "missing-means",
      "detail": "keine Browser-Engine im Prüfer angebunden (Mittel rendering)"
    },
    {
      "rule": "HPR-LOCK-005",
      "reason": "missing-means",
      "detail": "keine Liste redigierter Begriffe übergeben (--redacted)"
    },
    {
      "rule": "HPR-SBX-010",
      "reason": "missing-means",
      "detail": "keine Browser-Engine im Prüfer angebunden (Mittel rendering)"
    },
    {
      "rule": "HPR-SBX-012",
      "reason": "missing-means",
      "detail": "keine Browser-Engine im Prüfer angebunden (Mittel rendering)"
    },
    {
      "rule": "HPR-SBX-015",
      "reason": "missing-means",
      "detail": "keine Browser-Engine im Prüfer angebunden (Mittel rendering)"
    }
  ]
}
