{
  "spec": "https://hpro.example/spec/0.1",
  "catalog": {
    "part": "1",
    "version": "0.1",
    "rules": 156
  },
  "tool": {
    "name": "hpro-check (hpro Konformitätsprüfer)",
    "version": "0.1.0"
  },
  "checkedAt": "2026-10-14T18:01:17Z",
  "file": {
    "name": "aktennotiz.hpro",
    "size": 4047,
    "sha256": "3d80620437acd21c9a251d2086aa209f49ae6163a3e1e9bbfe167ca4fa8cf550"
  },
  "strict": false,
  "levels": {
    "claimed": [
      "Basis"
    ],
    "requested": [],
    "verdict": {
      "Basis": "unbestimmt"
    }
  },
  "renditions": [
    {
      "id": null,
      "profile": "static",
      "verdict": {
        "Basis": "unbestimmt"
      }
    }
  ],
  "summary": {
    "fatal": 0,
    "error": 0,
    "warning": 0,
    "info": 0,
    "notChecked": 4
  },
  "results": [],
  "notChecked": [
    {
      "rule": "HPR-INH-004",
      "reason": "missing-means",
      "detail": "keine Browser-Engine im Prüfer angebunden (Mittel rendering)"
    },
    {
      "rule": "HPR-INH-006",
      "reason": "missing-means",
      "detail": "keine Browser-Engine im Prüfer angebunden (Mittel rendering)"
    },
    {
      "rule": "HPR-INH-022",
      "reason": "missing-means",
      "detail": "keine Browser-Engine im Prüfer angebunden (Mittel rendering)"
    },
    {
      "rule": "HPR-LOCK-005",
      "reason": "missing-means",
      "detail": "keine Liste redigierter Begriffe übergeben (--redacted)"
    }
  ]
}
